{
  "$schema": "../schemas/weapon.schema.json",
  "id": "item.pistol",
  "name": "pistol",
  "description": "A service automatic, one magazine, no spares that you have found. Three shots is a fight; the fourth is a decision.",
  "kind": "firearm",
  "category": "firearm",
  "dmgMin": 3,
  "dmgMax": 3,
  "noise": 75,
  "armorPierce": 3,
  "accuracy": 0.75,
  "lootWeight": 3,
  "lootKinds": [
    "police"
  ],
  "notes": "T80 dials, T81 rarity. On the pre-T81 uniform police table a pistol came out of 24.6% of searches — as likely as a bandage. Weighted it is 3 against BASE_LOOT_WEIGHT 18, measured at 4.7% of police searches."
}
